{
  "number": "NS-1",
  "type": "380",
  "issue_date": "2026-10-23",
  "delivery_date": "2026-10-20",
  "currency": "EUR",
  "buyer_reference": "04011000-12345-67",
  "order_reference": "BEST-7781",
  "note": "Vielen Dank für Ihren Auftrag.",
  "seller": {
    "name": "Muster Software GmbH",
    "street": "Hauptstraße 1",
    "postcode": "10115",
    "city": "Berlin",
    "country": "DE",
    "tax_number": "30/123/45678",
    "register_id": "HRB 123456 B",
    "legal_info": "Amtsgericht Charlottenburg, Geschäftsführerin: Erika Muster",
    "email": "rechnung@muster-software.de",
    "contact": {
      "name": "Erika Muster",
      "phone": "+49 30 1234567",
      "email": "buchhaltung@muster-software.de"
    }
  },
  "buyer": {
    "name": "Stadtverwaltung Beispielstadt",
    "street": "Rathausplatz 5",
    "postcode": "80331",
    "city": "München",
    "country": "DE",
    "email": "e-rechnung@beispielstadt.de",
    "id": "K-10023"
  },
  "lines": [
    {
      "name": "Leistung im Ausland (nicht steuerbar)",
      "quantity": 1,
      "price": 800,
      "vat_category": "O"
    }
  ],
  "payment": {
    "means": "58",
    "iban": "DE02120300000000202051",
    "bic": "BYLADEM1001",
    "terms_days": 30,
    "discount": {
      "days": 10,
      "percent": 2
    }
  }
}
