{
  "number": "GS-2026-0007",
  "type": "381",
  "issue_date": "2026-10-23",
  "delivery_date": "2026-10-20",
  "currency": "EUR",
  "buyer_reference": "04011000-12345-67",
  "order_reference": "BEST-7781",
  "note": "Rechnungskorrektur wegen Rücksendung.",
  "seller": {
    "name": "Muster Software GmbH",
    "street": "Hauptstraße 1",
    "postcode": "10115",
    "city": "Berlin",
    "country": "DE",
    "vat_id": "DE123456789",
    "tax_number": "30/123/45678",
    "register_id": "HRB 123456 B",
    "legal_info": "Amtsgericht Charlottenburg, Geschäftsführerin: Erika Muster",
    "email": "rechnung@muster-software.de",
    "contact": {
      "name": "Erika Muster",
      "phone": "+49 30 1234567",
      "email": "buchhaltung@muster-software.de"
    }
  },
  "buyer": {
    "name": "Stadtverwaltung Beispielstadt",
    "street": "Rathausplatz 5",
    "postcode": "80331",
    "city": "München",
    "country": "DE",
    "email": "e-rechnung@beispielstadt.de",
    "id": "K-10023"
  },
  "lines": [
    {
      "name": "Rücksendung Fachbuch",
      "quantity": 1,
      "unit": "H87",
      "price": 39.95,
      "vat_rate": 7
    }
  ],
  "payment": {
    "means": "58",
    "iban": "DE02120300000000202051"
  },
  "preceding_invoice": {
    "number": "RE-2026-0042",
    "date": "2026-10-23"
  }
}
